category_name,category_url,title,url,description,created_at,updated_at
nuevaCategora,nuevaCat,Aut in aliquid ut nisi.,eveniet,Impedit repudiandae et qui libero maxime doloremque.,2020-01-03 15:09:21,2020-01-03 15:09:21
culpa,vel,Qui rerum cumque sit ratione.,veritatis,Vitae harum blanditiis voluptatum maiores.,2020-01-03 15:09:21,2020-01-03 15:09:21
culpa,vel,Rem minima eos ab similique.,maxime,Hic asperiores officiis itaque.,2020-01-03 15:09:21,2020-01-03 15:09:21
culpa,vel,Quo enim dicta autem nihil.,nemo,Totam autem libero autem.,2020-01-03 15:09:21,2020-01-03 15:09:21
culpa,vel,Iste vero eos aliquid alias.,eius,Porro est qui eos consequatur.,2020-01-03 15:09:21,2020-01-03 15:09:21
culpa,vel,Et quaerat dolore debitis.,incidunt,Consequatur odio distinctio temporibus repudiandae.,2020-01-03 15:09:21,2020-01-03 15:09:21
aliquid,ipsum,Aut aut mollitia eos hic id.,autem,Molestias id ut et unde voluptas voluptate.,2020-01-03 15:09:21,2020-01-03 15:09:21
aliquid,ipsum,Voluptatum non sit eum.,delectus,Qui quod eius placeat.,2020-01-03 15:09:22,2020-01-03 15:09:22
et,corporis,Ut recusandae quis quo qui.,consequatur,Explicabo in qui porro cupiditate totam.,2020-01-03 15:09:22,2020-01-03 15:09:22
et,corporis,Modi enim sed aperiam ut.,velit,Eos vero amet nesciunt enim nisi.,2020-01-03 15:09:22,2020-01-03 15:09:22
et,corporis,Excepturi culpa commodi non.,debitis,Dolores ducimus beatae ea et sed.,2020-01-03 15:09:23,2020-01-03 15:09:23
et,corporis,Dolorem modi non ipsa.,cum,Id id dolorum porro.,2020-01-03 15:09:23,2020-01-03 15:09:23
accusamus,magni,Qui illum voluptatem eos.,ea,Delectus non modi voluptas.,2020-01-03 15:09:23,2020-01-03 15:09:23
accusamus,magni,Officia ut aperiam amet.,harum,Occaecati quae molestiae commodi.,2020-01-03 15:09:23,2020-01-03 15:09:23
accusamus,magni,Ab rem quod nesciunt numquam.,dignissimos,Occaecati adipisci distinctio dolore voluptatem quia.,2020-01-03 15:09:23,2020-01-03 15:09:23
accusamus,magni,Eius quis est et dolores.,fuga,Provident quam doloremque repudiandae qui.,2020-01-03 15:09:23,2020-01-03 15:09:23
eos,labore,Sit dolor voluptas molestiae.,possimus,Sed cum soluta at praesentium.,2020-01-03 15:09:23,2020-01-03 15:09:23
eos,labore,Itaque dolores ut expedita.,sed,Esse reiciendis suscipit vel nostrum architecto laudantium.,2020-01-03 15:09:23,2020-01-03 15:09:23
eos,labore,Sequi aut dolores sint quo.,dolorem,Et autem explicabo est est.,2020-01-03 15:09:23,2020-01-03 15:09:23
eos,labore,Et eum eveniet earum.,provident,Dolores enim laboriosam vitae sint cumque facilis.,2020-01-03 15:09:23,2020-01-03 15:09:23
qui,quia,Ullam dolor est sit nam.,tenetur,Blanditiis voluptatem et vel ut dolores ut.,2020-01-03 15:09:23,2020-01-03 15:09:23
qui,quia,Illo qui dicta et soluta.,quia,Id occaecati excepturi perspiciatis enim.,2020-01-03 15:09:23,2020-01-03 15:09:23
qui,quia,Sit quia qui earum quis.,at,Sequi totam voluptates nulla officiis ad.,2020-01-03 15:09:23,2020-01-03 15:09:23
qui,quia,Ea est quaerat quo tempora.,voluptatem,Aut beatae voluptates et ducimus beatae in.,2020-01-03 15:09:23,2020-01-03 15:09:23
debitis,sequi,Voluptatibus vel dolore amet.,vel,Asperiores ea omnis rerum vel.,2020-01-03 15:09:24,2020-01-03 15:09:24
dolores,excepturi,Voluptates sed quas eos.,doloremque,Excepturi voluptatem nemo temporibus.,2020-01-03 15:09:25,2020-01-03 15:09:25
sunt,ut,Provident et modi dolores.,mollitia,Numquam similique saepe inventore ad expedita assumenda.,2020-01-03 15:09:25,2020-01-03 15:09:25
esse,laboriosam,Natus quis eaque repellat.,iusto,Illum sed illum et.,2020-01-03 15:09:25,2020-01-03 15:09:25
esse,laboriosam,Nobis magni et sit ab.,nobis,Alias voluptatem eos exercitationem aperiam minus.,2020-01-03 15:09:25,2020-01-03 15:09:25
esse,laboriosam,Eos sit officia ad dicta est.,eos,Beatae nisi omnis occaecati qui ipsa.,2020-01-03 15:09:25,2020-01-03 15:09:25
