id,category_id,title,url,description,created_at,updated_at
1,4,Aut in aliquid ut nisi.,eveniet,Impedit repudiandae et qui libero maxime doloremque.,2020-01-03 15:09:21,2020-01-03 15:09:21
2,6,Qui rerum cumque sit ratione.,veritatis,Vitae harum blanditiis voluptatum maiores.,2020-01-03 15:09:21,2020-01-03 15:09:21
3,3,Rem minima eos ab similique.,maxime,Hic asperiores officiis itaque.,2020-01-03 15:09:21,2020-01-03 15:09:21
4,5,Quo enim dicta autem nihil.,nemo,Totam autem libero autem.,2020-01-03 15:09:21,2020-01-03 15:09:21
5,4,Iste vero eos aliquid alias.,eius,Porro est qui eos consequatur.,2020-01-03 15:09:21,2020-01-03 15:09:21
6,7,Et quaerat dolore debitis.,incidunt,Consequatur odio distinctio temporibus repudiandae.,2020-01-03 15:09:21,2020-01-03 15:09:21
7,6,Aut aut mollitia eos hic id.,autem,Molestias id ut et unde voluptas voluptate.,2020-01-03 15:09:21,2020-01-03 15:09:21
8,2,Voluptatum non sit eum.,delectus,Qui quod eius placeat.,2020-01-03 15:09:22,2020-01-03 15:09:22
9,1,Ut recusandae quis quo qui.,consequatur,Explicabo in qui porro cupiditate totam.,2020-01-03 15:09:22,2020-01-03 15:09:22
10,10,Modi enim sed aperiam ut.,velit,Eos vero amet nesciunt enim nisi.,2020-01-03 15:09:22,2020-01-03 15:09:22
11,7,Excepturi culpa commodi non.,debitis,Dolores ducimus beatae ea et sed.,2020-01-03 15:09:23,2020-01-03 15:09:23
12,9,Dolorem modi non ipsa.,cum,Id id dolorum porro.,2020-01-03 15:09:23,2020-01-03 15:09:23
13,9,Qui illum voluptatem eos.,ea,Delectus non modi voluptas.,2020-01-03 15:09:23,2020-01-03 15:09:23
14,3,Officia ut aperiam amet.,harum,Occaecati quae molestiae commodi.,2020-01-03 15:09:23,2020-01-03 15:09:23
15,6,Ab rem quod nesciunt numquam.,dignissimos,Occaecati adipisci distinctio dolore voluptatem quia.,2020-01-03 15:09:23,2020-01-03 15:09:23
16,8,Eius quis est et dolores.,fuga,Provident quam doloremque repudiandae qui.,2020-01-03 15:09:23,2020-01-03 15:09:23
17,10,Sit dolor voluptas molestiae.,possimus,Sed cum soluta at praesentium.,2020-01-03 15:09:23,2020-01-03 15:09:23
18,7,Itaque dolores ut expedita.,sed,Esse reiciendis suscipit vel nostrum architecto laudantium.,2020-01-03 15:09:23,2020-01-03 15:09:23
19,7,Sequi aut dolores sint quo.,dolorem,Et autem explicabo est est.,2020-01-03 15:09:23,2020-01-03 15:09:23
20,6,Et eum eveniet earum.,provident,Dolores enim laboriosam vitae sint cumque facilis.,2020-01-03 15:09:23,2020-01-03 15:09:23
21,1,Ullam dolor est sit nam.,tenetur,Blanditiis voluptatem et vel ut dolores ut.,2020-01-03 15:09:23,2020-01-03 15:09:23
22,2,Illo qui dicta et soluta.,quia,Id occaecati excepturi perspiciatis enim.,2020-01-03 15:09:23,2020-01-03 15:09:23
23,8,Sit quia qui earum quis.,at,Sequi totam voluptates nulla officiis ad.,2020-01-03 15:09:23,2020-01-03 15:09:23
24,10,Ea est quaerat quo tempora.,voluptatem,Aut beatae voluptates et ducimus beatae in.,2020-01-03 15:09:23,2020-01-03 15:09:23
25,7,Voluptatibus vel dolore amet.,vel,Asperiores ea omnis rerum vel.,2020-01-03 15:09:24,2020-01-03 15:09:24
26,2,Voluptates sed quas eos.,doloremque,Excepturi voluptatem nemo temporibus.,2020-01-03 15:09:25,2020-01-03 15:09:25
27,10,Provident et modi dolores.,mollitia,Numquam similique saepe inventore ad expedita assumenda.,2020-01-03 15:09:25,2020-01-03 15:09:25
28,7,Natus quis eaque repellat.,iusto,Illum sed illum et.,2020-01-03 15:09:25,2020-01-03 15:09:25
29,8,Nobis magni et sit ab.,nobis,Alias voluptatem eos exercitationem aperiam minus.,2020-01-03 15:09:25,2020-01-03 15:09:25
30,10,Eos sit officia ad dicta est.,eos,Beatae nisi omnis occaecati qui ipsa.,2020-01-03 15:09:25,2020-01-03 15:09:25
