category_name,category_url,title,url,description,created_at,updated_at
accusamus,magni,Qui illum voluptatem eos.,ea,Delectus non modi voluptas.,2020-01-03 15:09:23,2020-01-03 15:09:23
newCategory1,newCat1,Voluptatum non sit eum.,delectus,Qui quod eius placeat.,2020-01-03 15:09:22,2020-01-03 15:09:22
aliquid,ipsum,Aut aut mollitia eos hic id.,autem,Molestias id ut et unde voluptas voluptate.,2020-01-03 15:09:21,2020-01-03 15:09:21
culpa,vel,Et quaerat dolore debitis.,incidunt,Consequatur odio distinctio temporibus repudiandae.,2020-01-03 15:09:21,2020-01-03 15:09:21
newCategory2,newCat2,Lorem ipsum,lorem_ipsum,"Cum sociis natoque penatibus et magnis dis parturient montes, nascetur ridiculus mus.",2020-01-03 15:09:22,2020-01-03 15:09:22
eos,labore,Et eum eveniet earum.,provident,Dolores enim laboriosam vitae sint cumque facilis.,2020-01-03 15:09:23,2020-01-03 15:09:23
esse,laboriosam,Eos sit officia ad dicta est.,eos,Beatae nisi omnis occaecati qui ipsa.,2020-01-03 15:09:25,2020-01-03 15:09:25
et,corporis,Dolorem modi non ipsa.,cum,Id id dolorum porro.,2020-01-03 15:09:23,2020-01-03 15:09:23
newCategory3,newCat3,Itaque dolores ut expedita.,sed,Esse reiciendis suscipit vel nostrum architecto laudantium.,2020-01-03 15:09:22,2020-01-03 15:09:22
qui,quia,Ullam dolor est sit nam.,tenetur,Blanditiis voluptatem et vel ut dolores ut.,2020-01-03 15:09:23,2020-01-03 15:09:23
newCategory4,newCat4,Cicero,cicero,Sed ut perspiciatis unde omnis iste natus error sit voluptatem accusantium doloremque laudantium,2020-01-03 15:09:23,2020-01-03 15:09:23
newCategory5,newCat5,Don Quijote,Don_Quijote,"Así que, no debes congojarte por las desgracias que a mí me suceden, pues a ti no te cabe parte dellas.",2020-01-03 15:09:23,2020-01-03 15:09:23
