category_name,category_url,title,url,description
Categoría 1,url_cat1,Aut in aliquid ut nisi.,eveniet,Impedit repudiandae et qui libero maxime doloremque.
Categoría 2,url_cat2,Qui rerum cumque sit ratione.,veritatis,Vitae harum blanditiis voluptatum maiores.
Categoría 3,url_cat3,Rem minima eos ab similique.,maxime,Hic asperiores officiis itaque.
Categoría 4,url_cat4,Quo enim dicta autem nihil.,nemo,Totam autem libero autem.
Categoría 5,url_cat5,Iste vero eos aliquid alias.,eius,Porro est qui eos consequatur.
